{
  "format": "residiuum-rql-qual-evidence-bundle-v1",
  "harness_profile": "residiuum-rql-qual-harness-v1",
  "env": {
    "format": "residiuum-rql-qual-env-fingerprint-v1",
    "harness_profile": "residiuum-rql-qual-harness-v1",
    "git_sha": "985271766780f24dda682e65db7c12d5e5fcdf3d",
    "dirty": true,
    "residiuum_version": "0.2.2",
    "rustc": "rustc 1.92.0 (ded5c06cf 2025-12-08)",
    "os": "macos",
    "arch": "aarch64",
    "hostname_class": "controlled_host_unspecified",
    "recorded_unix_s": 1786246775,
    "mongo_pin": "8.2.12",
    "cbl_pin": "4.1.0",
    "cbl_full_sync": true,
    "query_defaults": {
      "consistency_mode": "Available",
      "coverage_policy": "Complete",
      "page_size": 64
    }
  },
  "campaign_id": "q4-3-unit",
  "protocol": {
    "class": "scaffold",
    "seed": 1091,
    "warmup_operations": 0,
    "minimum_repetitions": 1,
    "minimum_duration_ms": 0,
    "minimum_operations": 1,
    "engine_order_policy": "fixed_scaffold_not_competitive"
  },
  "notes": [
    "Q4.1 scaffold — not Gate-1; not competitive",
    "Mongo/CBL adapters not configured until Q4.3",
    "Q4.3 smoke — not competitive / not Gate-1",
    "side_a=logical_harness digests; side_b=CBL NotConfigured with shared_work",
    "lane_s_fixture_identity ok=true hash=6ceee18d58f8e92fe18325221bc23a927eef65577bfa9b25da7aa9d01f87e1e2"
  ],
  "cells": [
    {
      "cell_id": "cell_key_get_smoke_c1",
      "case_id": "cell_key_get_smoke_c1",
      "lane": "embedded",
      "pairing": {
        "lane": "embedded",
        "side_a": "logical_harness",
        "side_b": "couchbase_lite_embedded"
      },
      "concurrency": 1,
      "achieved_concurrency": 1,
      "side_a": {
        "engine": "logical_harness",
        "execution_kind": "logical_simulator",
        "status": "ready",
        "result": {
          "keys_digest": "684da7bb288def1fc8e6d66715b495a54a792b64353824b916dab93e814359a8",
          "values_digest": "c1f76517600b12f64088bf801f47809aabb8a1b84d0e1f26d22e1c86441310e2",
          "multiplicity": "multiset",
          "order_sensitive": false,
          "coverage_complete": true,
          "row_count": 1
        },
        "metrics": {
          "queries_per_s": 104351.45570280706,
          "latency": {
            "p50": 9583,
            "p95": 9583,
            "p99": 9583,
            "max": 9583,
            "samples": 1
          },
          "resource": {
            "cpu_time_ns": null,
            "rss_bytes": null,
            "peak_rss_bytes": null,
            "physical_bytes_read": null,
            "physical_bytes_written": null,
            "read_amplification": null
          },
          "path": {
            "documents_examined": 64,
            "index_entries_examined": null,
            "index_size_bytes": null,
            "index_build_ns": null,
            "indexed_write_penalty_ns": null,
            "explain_plan_digest": "logical_plan:36313b794607a8b67683d5da5f9b5f52d7ddfa4be73d9aa3e33b04be62108821"
          },
          "lifecycle": "warm_steady",
          "cold_method": "not_cold_warm_steady",
          "deferred_work_units": 0,
          "deferred_drained": true,
          "result_digest_echo": "c1f76517600b12f64088bf801f47809aabb8a1b84d0e1f26d22e1c86441310e2",
          "coverage_complete": true,
          "validity_ok": true
        },
        "refuse_code": null,
        "detail": "logical_harness plan=cell_key_get_smoke_c1 examined=64  concurrency_requested=1 concurrency_achieved=1 workers=1",
        "shared_work_hash": "6ceee18d58f8e92fe18325221bc23a927eef65577bfa9b25da7aa9d01f87e1e2"
      },
      "side_b": {
        "engine": "couchbase_lite_embedded",
        "execution_kind": "not_configured",
        "status": "not_configured",
        "result": null,
        "metrics": null,
        "refuse_code": "adapter_not_configured:cbl_embedded",
        "detail": "shared logical work loaded=true; plan=cell_key_get_smoke_c1 (CBL native residual)",
        "shared_work_hash": "6ceee18d58f8e92fe18325221bc23a927eef65577bfa9b25da7aa9d01f87e1e2"
      },
      "equivalent": null,
      "equivalence_detail": "one or both sides missing canonical result",
      "metrics_a": {
        "queries_per_s": 104351.45570280706,
        "latency": {
          "p50": 9583,
          "p95": 9583,
          "p99": 9583,
          "max": 9583,
          "samples": 1
        },
        "resource": {
          "cpu_time_ns": null,
          "rss_bytes": null,
          "peak_rss_bytes": null,
          "physical_bytes_read": null,
          "physical_bytes_written": null,
          "read_amplification": null
        },
        "path": {
          "documents_examined": 64,
          "index_entries_examined": null,
          "index_size_bytes": null,
          "index_build_ns": null,
          "indexed_write_penalty_ns": null,
          "explain_plan_digest": "logical_plan:36313b794607a8b67683d5da5f9b5f52d7ddfa4be73d9aa3e33b04be62108821"
        },
        "lifecycle": "warm_steady",
        "cold_method": "not_cold_warm_steady",
        "deferred_work_units": 0,
        "deferred_drained": true,
        "result_digest_echo": "c1f76517600b12f64088bf801f47809aabb8a1b84d0e1f26d22e1c86441310e2",
        "coverage_complete": true,
        "validity_ok": true
      },
      "metrics_b": null,
      "raw_repetitions": [],
      "scaffold_only": true
    },
    {
      "cell_id": "cell_indexed_eq_multi_sel_smoke_c1",
      "case_id": "cell_indexed_eq_multi_sel_smoke_c1",
      "lane": "embedded",
      "pairing": {
        "lane": "embedded",
        "side_a": "logical_harness",
        "side_b": "couchbase_lite_embedded"
      },
      "concurrency": 1,
      "achieved_concurrency": 1,
      "side_a": {
        "engine": "logical_harness",
        "execution_kind": "logical_simulator",
        "status": "ready",
        "result": {
          "keys_digest": "7852cc456e308d8c23142016fb9a147cef1277ed2fccc6196395bc4742dff2e3",
          "values_digest": "de466d71416fe3d6fe66f50fb321099e4282229608175e540e24f45b7a913350",
          "multiplicity": "multiset",
          "order_sensitive": false,
          "coverage_complete": true,
          "row_count": 7
        },
        "metrics": {
          "queries_per_s": 24665.778698633516,
          "latency": {
            "p50": 40542,
            "p95": 40542,
            "p99": 40542,
            "max": 40542,
            "samples": 1
          },
          "resource": {
            "cpu_time_ns": null,
            "rss_bytes": null,
            "peak_rss_bytes": null,
            "physical_bytes_read": null,
            "physical_bytes_written": null,
            "read_amplification": null
          },
          "path": {
            "documents_examined": 64,
            "index_entries_examined": null,
            "index_size_bytes": null,
            "index_build_ns": null,
            "indexed_write_penalty_ns": null,
            "explain_plan_digest": "logical_plan:b56778a1faebb11c63e86eee6c1bd07c7e6cedb33e05f6f8f8c4d9cd9d331743"
          },
          "lifecycle": "warm_steady",
          "cold_method": "not_cold_warm_steady",
          "deferred_work_units": 0,
          "deferred_drained": true,
          "result_digest_echo": "de466d71416fe3d6fe66f50fb321099e4282229608175e540e24f45b7a913350",
          "coverage_complete": true,
          "validity_ok": true
        },
        "refuse_code": null,
        "detail": "logical_harness plan=cell_indexed_eq_multi_sel_smoke_c1 examined=64 sel_bucket=HIT concurrency_requested=1 concurrency_achieved=1 workers=1",
        "shared_work_hash": "92088254cf2092ba166fc0ab0f07db2e5b9cbc8498aa62765f11c2ba1987faae"
      },
      "side_b": {
        "engine": "couchbase_lite_embedded",
        "execution_kind": "not_configured",
        "status": "not_configured",
        "result": null,
        "metrics": null,
        "refuse_code": "adapter_not_configured:cbl_embedded",
        "detail": "shared logical work loaded=true; plan=cell_indexed_eq_multi_sel_smoke_c1 (CBL native residual)",
        "shared_work_hash": "92088254cf2092ba166fc0ab0f07db2e5b9cbc8498aa62765f11c2ba1987faae"
      },
      "equivalent": null,
      "equivalence_detail": "one or both sides missing canonical result",
      "metrics_a": {
        "queries_per_s": 24665.778698633516,
        "latency": {
          "p50": 40542,
          "p95": 40542,
          "p99": 40542,
          "max": 40542,
          "samples": 1
        },
        "resource": {
          "cpu_time_ns": null,
          "rss_bytes": null,
          "peak_rss_bytes": null,
          "physical_bytes_read": null,
          "physical_bytes_written": null,
          "read_amplification": null
        },
        "path": {
          "documents_examined": 64,
          "index_entries_examined": null,
          "index_size_bytes": null,
          "index_build_ns": null,
          "indexed_write_penalty_ns": null,
          "explain_plan_digest": "logical_plan:b56778a1faebb11c63e86eee6c1bd07c7e6cedb33e05f6f8f8c4d9cd9d331743"
        },
        "lifecycle": "warm_steady",
        "cold_method": "not_cold_warm_steady",
        "deferred_work_units": 0,
        "deferred_drained": true,
        "result_digest_echo": "de466d71416fe3d6fe66f50fb321099e4282229608175e540e24f45b7a913350",
        "coverage_complete": true,
        "validity_ok": true
      },
      "metrics_b": null,
      "raw_repetitions": [],
      "scaffold_only": true
    },
    {
      "cell_id": "cell_range_compound_smoke_c1",
      "case_id": "cell_range_compound_smoke_c1",
      "lane": "embedded",
      "pairing": {
        "lane": "embedded",
        "side_a": "logical_harness",
        "side_b": "couchbase_lite_embedded"
      },
      "concurrency": 1,
      "achieved_concurrency": 1,
      "side_a": {
        "engine": "logical_harness",
        "execution_kind": "logical_simulator",
        "status": "ready",
        "result": {